message_id,date_utc,text,text_len,views,reactions,engagement
379,2024-02-05 15:07:22+00:00,"- Представься. - Карсанов Артур, специалист сообщества студентов в Санкт-Петербурге, Ямал-корпорация. - Что такое Ямал-корпорация? - Мы - сообщество студентов, проживающих на территории Санкт-Петербурга, ребята, которые планируют раскрасить свои учебные будни или связать свою жизнь с Ямало-Ненецким автономным округом. - Подскажи, пожалуйста, на каких студентов рассчитана корпорация? - Абсолютно на всех ребят, которые хотят развиваться, активно проводить свои студенческие будни, возможно в будущем стать частичкой нашего региона. - Чем вы занимаетесь? - Проводим тематические мероприятия, развиваем Ямальское комьюнити за пределами округа, всячески способствуем привлечению молодых ребят с других регионов к Ямальской повестке и привлечению их в наш регион. В целом занимаемся освещением и реализацией Ямальских мероприятий, то-есть проводим и анонсируем форумы, мастер классы, важные лекции, камерные, локальные встречи, выездные мероприятия, экскурсии, прогулки. Стараемся работать не на количество, а на качество, заинтересовать и привлечь студентов из различных регионов в Ямальскую команду. В последнее время также сотрудничаем с сетью штабов Ямальских студентов в городах округа, Москве, Санкт-Петербурге и Тюмени “Те кто с Ямала”. - Можешь рассказать об одном из последних мероприятий? - Совсем недавно мы проводили день студента с уютной атмосферой, насыщенной программой, крутыми призами и выступлениями от ведущих спикеров. - Супер, что можешь сказать ребята, которые захотят присоединиться к вашему сообществу? - Мы будем рады абсолютно каждому из ребят, которые захотят разделить с нами свое студенчество, вместе мы сможем создать уютное и вдохновляющее сообщество, поддерживать друг друга и делать университетскую жизнь ярче и интереснее. Ссылки на Ямал-корпорацию Вк: https://vk.com/yamal_spb Тг: https://t.me/yamalspb",1836,589,10,0.01697792869269949
380,2024-02-07 13:07:37+00:00,Продолжаем выкладывать работы наших учеников ✨ Следующее интервью от Владислава Бадмаева группа 4318👇🏻,102,448,5,0.011160714285714286
381,2024-02-07 13:08:05+00:00,"y2k возвращается, вместе с этим возвращается и Лабудидабулайхтман😎. Мы взяли мини-интервью у этого любителя моды🧣 и готовы с радостью поделиться им с вами)",155,451,26,0.057649667405764965
388,2024-02-09 12:06:21+00:00,Завершаем марафон интервью от наших учеников работой Рябухина Владислава группа 3335М👇🏻,87,500,6,0.012
389,2024-02-09 12:06:36+00:00,"Владислав: Привет, Мария! Можешь ли ты рассказать нам о своей работе в Центре компетенций? Какие главные задачи и обязанности включает в себя твоя должность? Мария: Уже около двух лет я работаю специалистом Центра Компетенций. Мои задачи — это не только организация процессов работы (планирование, контроль, вдохновение). Я стремлюсь в своей работе к основной цели Центра: это развитие мягких навыков у студентов, чтобы в жизни, в обучении, и в работе им было легко и комфортно. Ну а если разобрать этапы работ - то мы вместе с коллегами: привлекаем студентов к тестированию-оценке своих мягких навыков, приглашаем на тренинги и мастер-классы, организуем встречу студентов с работодателями, ведём школу Амбассадоров и многое другое :) Так как ранее я более 10 лет работала в HR, управлении человеческими ресурсами - то моя область работы - это мастер-классы по построению своей карьерной траектории. Владислав: Какие тренинги и мастер-классы ты ведешь в Центре компетенций? Можешь ли поделиться информацией о двух таких мероприятиях, которые тебе особенно близки? Мария: ""Каналы поиска работы - с чего начать"" ""Что такое резюме - как его лучше составить"" ""Как спокойно и уверенно пройти собеседование"" ""Адаптация на новом месте работы"" Выделить какие-то особенные для себя не могу. Но мне ещё очень нравится индивидуально работать со студентами - как раз такой формат ""Индивидуальные дни консультации"" мы запускаем с февраля 2024 года Владислав: Почему студентам и сотрудникам университета следует посетить твой тренинг или мастер-класс? Какую практическую пользу они получат от участия? Мария: После того как принято решение о поиске места работы, стажировки или практики - появляется много вопросов: Куда обращаться, что делать, смогу ли я показать себя как специалист, что говорить и спрашивать на встрече с рекрутером и т.д. На МК и индивидуальных беседах мы детально вместе разберёмся со всеми подобными вопросами и поймём, что поиск места работы - это увлекательный процесс, и что - это не страшно и сложно ) Владислав: Когда будет ближайший тренинг или мастер-класс, на который можно записаться? Мария: Про ближайшие МК информацию будем публиковать в нашем канале Друзья Центра Компетенций.",2197,564,10,0.01773049645390071
390,2024-02-10 07:49:41+00:00,Этот сонный котик передает вам свою милоту и заряжает на хорошие выходные 💜 #милота,83,559,17,0.03041144901610018
391,2024-02-11 11:30:06+00:00,#мем_недели,11,498,20,0.040160642570281124
392,2024-02-13 11:40:22+00:00,"🌯Сегодня отмечается День шавермы🌯 В честь праздника подборка вкусных мест с шавермой рядом с корпусами ГУАП: 📌 «Бистро пирамида» Авиационная ул., 15, Московский район, 196066 ( рядом с корпусом на Гастелло, 15) 📌 «О,Тандыр!» Санкт-Петербург, Конногвардейский бульвар • этаж цокольный ( рядом с корпусом на Большой Морской,67) 📌 «Донер Кебаб» ул. Ленсовета, 16, 196135 • этаж 1 ( рядом с корпусом на Ленсовета,14) Приятного аппетита 😋",433,457,17,0.037199124726477024
393,2024-02-14 08:18:32+00:00,"Поздравляем всех с Днём Святого Валентина💗 Желаем быть влюбленными в эту жизнь и в себя! Пусть этот день напомнит о том, что любовь и дружба — это силы, способные творить чудеса! Пусть в ваших сердцах цветут семена добра, щедрости и поддержки, помогая вам добиваться успехов и преодолевать все препятствия на пути к своим целям! Давайте закидаем комментарии сердечками 💜",370,462,15,0.032467532467532464
394,2024-02-15 13:11:46+00:00,"Идет вторая неделя учебы, но каникулы не отпускают нас! Самые балдёжные активисты сняли для вас влоги с каникул в родном городе. Предлагаем узнать поближе ребят и места, в которых они выросли✨ Видео будут появляться тут иногда! Может там будет и твой город 🏙️",259,830,18,0.021686746987951807
396,2024-02-16 16:27:13+00:00,"Подглядываем, как проходит первая лекция в школе профоргов☝🏻",60,555,21,0.03783783783783784
397,2024-02-17 11:29:46+00:00,"Заряжаемся милотой на хорошие выходные от спящего котика, который явно ехал к первой паре 💗 #милота",99,600,21,0.035
398,2024-02-19 10:07:51+00:00,"Учебное расписание на ближайшие дни💫 💜22 февраля (четверг) — 3 пары по расписанию; 💜23 февраля (пятница) — выходной праздничный день, вуз не работает; 💜24 февраля (суббота) — все пары по расписанию. Мы любим выходные и отдых! Ставь реакцию, если тоже✨",251,623,33,0.052969502407704656
399,2024-02-22 10:54:49+00:00,А какой активист именно ты?! Делай скриншот и присылай в комменты💜,66,439,16,0.03644646924829157
400,2024-02-23 09:01:00+00:00,"🎉 Дорогие наши мужчины! Поздравляем вас с замечательным праздником - Днём защитника Отечества! 💪🏻Желаем, чтоб каждый день приносил вам радость, теплоту и новые победы! Пусть ваши доблестные поступки и подвиги прославляют и вносят свет в жизнь окружающих! 💜Спасибо, что всегда готовы защитить нас!",296,470,34,0.07234042553191489
401,2024-02-24 09:43:42+00:00,Танцующий котик посылает вам милоту на хорошие выходные💜 #милота,64,557,22,0.03949730700179533
402,2024-02-25 12:21:24+00:00,"Мы хотим совершенствоваться! Для этого нам нужна твоя помощь! Если у тебя есть Premium, то проголосуй,пожалуйста, за возможность делать наш канал еще круче и красивее💜 https://t.me/boost/guap4you",195,552,21,0.03804347826086957
403,2024-02-25 14:44:11+00:00,#мем_недели,11,630,27,0.04285714285714286
405,2024-02-27 15:21:56+00:00,Наши ребята на третьей лекции школы профоргов 🔥,47,516,8,0.015503875968992248
407,2024-03-01 11:54:33+00:00,"Депрессия покидает наши тела! Наконец-то наступила весна💜 С первым марта, балдёжные ребята🌸",91,451,25,0.05543237250554324
408,2024-03-02 07:17:25+00:00,Милый пёсик желает вам хороших выходных💜 #милота,48,511,24,0.046966731898238745
409,2024-03-03 11:15:19+00:00,#мем_недели,11,539,22,0.04081632653061224
410,2024-03-04 07:40:16+00:00,Давайте проведем эту неделю продуктивно!🧑‍💻 Ставим «🔥» и заряжаемся энергией,76,543,34,0.06261510128913444
411,2024-03-05 09:03:36+00:00,Ловите расписание учебных дней на этой неделе: 🌸 7 марта – учебные занятия по расписанию(первые три пары) 🌸 8 марта – нерабочий праздничный день 🌸 9 марта – учебные занятия по расписанию,186,470,22,0.04680851063829787
412,2024-03-07 13:20:40+00:00,"😱Объявляем конкурс!😱 Мы загадали активиста через его эстетику✨ Пиши в комментариях свою догадку (Имя и Фамилию) Если ты будешь первым, кто ответит правильно, то получишь подарок от этого активиста! 🍀Удачи🍀",205,508,13,0.025590551181102362
413,2024-03-08 07:49:49+00:00,"Прекрасные девушки, с вашим праздником! 💜 Сияйте, улыбайтесь и просто будьте собой! Именно вы делаете этот мир прекрасней и лучше😍",130,503,25,0.04970178926441352
415,2024-03-09 10:11:39+00:00,Милый ёжик заряжает тебя на хорошие выходные💜 #милота,53,476,11,0.023109243697478993
416,2024-03-12 14:38:18+00:00,Наши самые балдёжные первокурсники🤩 А какой активист сегодня ты?! Присылай скриншот в комментариях👇🏻,100,685,15,0.021897810218978103
417,2024-03-14 10:50:58+00:00,"Привет всем балдëжным студентикам 🤗 Меня зовут Маша (Николаева), учусь на третьем курсе лучшего 4 института, в группе 4127, и сегодня вы проведëте день со мной 🌞 В нашем профбюро я дизайнер и активист, делаю картинки для группы вк, помогаю с презентациями и любым оформлением 🎨 Ещë меня можно встретить в офисе профкома на БМ в роли секретаря (например сегодня с 15 часов, заходите – поболтаем). Я обожаю вкусно покушать, ставь реакцию, если ты тоже 🍓 Но помимо этого я люблю заниматься рукоделием (рисую, вяжу, вышиваю - всë идëт от настроения) и музыкой, фотографирую на плëнку 📷 Ставьте реакции и ждите новых постов от меня 😘",628,464,36,0.07758620689655173
419,2024-03-14 15:13:54+00:00,"А здесь мы учимся дышать, и вам немножко показываю 😎 Если сделаете это упражнение, от меня респект и уважение 🫁",111,425,5,0.011764705882352941
421,2024-03-14 19:29:43+00:00,"Время 22:20, но мы не расслабляемся 🦾 Важные люди решают судьбу важного конкурса – Лучший профорг 4 профбюро 🏆 Ставь реакцию 🔥 – если ты участвуешь, 🍓 – если будешь наблюдать за ходом конкурса и 🤪 – если ты просто очень устал сегодня...",236,442,42,0.09502262443438914
422,2024-03-14 21:02:33+00:00,"Ну и на ночь глядя хочу вам напомнить, что вы можете поддержать меня и других участников из балдёжного четвёртого в голосовании на зрительский иммунитет 🥰 Всем желаю самых приятных снов, была рада провести этот день с вами 🤗",224,542,19,0.03505535055350553
423,2024-03-16 11:44:32+00:00,Котокосатка желает вам хороших выходных 💜 #милота,49,449,20,0.044543429844097995
424,2024-03-17 09:00:40+00:00,"Последний день, когда официально разрешено объедаться блинами 😋 В честь праздника Масленица устраиваем опрос! Какая начинка к блинчикам самая вкусная? ❤️- Варенье(любого вкуса) 💅🏻- Сгущенное молоко 🔥- Сметанка 👍🏻- Ветчина и сыр 🥰- Простые без начинки 😜- Свой ответ в комментариях ~Скорее оставляй реакцию~",305,562,38,0.06761565836298933
425,2024-03-19 10:20:31+00:00,"💥 Стикер БУМ 💥 Присылай в комментариях стикеры описывающие твое состояние сейчас! Надеемся, что они будут только хорошие 😻",122,531,11,0.02071563088512241
427,2024-03-21 13:53:31+00:00,Сейчас проходит первый день конкурса «Лучший профорг 4-го профбюро 2024»🔥 Поддержим ребят в комментариях 👇🏻,107,526,10,0.019011406844106463
430,2024-03-22 13:35:07+00:00,Уже в ожидании результатов 🫣🙀,29,581,10,0.01721170395869191
431,2024-03-22 15:24:23+00:00,"Мы знаем, что вы этого ждали! Результаты конкурса «Лучший профорг 4-го профбюро 2024» 1 место - Владислав Бадмаев💎 2 место - Софья Фефелова☀️ 3 место - Артём Ледовских ✨ 4 место - Дарья Кучер😎 5 место - Данил Бычков👌🏻 🎉Поздравляем наших профоргов",246,667,27,0.04047976011994003
433,2024-03-23 06:01:17+00:00,"Друзья, просим вас оставаться на выходные дома, не посещать торговые центры, места массового скопления людей🙏 Старайтесь сохранять спокойствие, не переживать🥺 Если вам нужна психологическая поддержка, то в ГУАПе работают бесплатные специалисты Запись по телефону: 8921-182-35-87 Лариса Владимировна 8969-206-46-66 Дмитрий Олегович Давайте держаться вместе, беречь себя и своих близких❤️",386,711,27,0.0379746835443038
434,2024-03-27 14:23:14+00:00,Вау! Этот тестик специально для тебя 🙌🏻 https://uquiz.com/quiz/yEWzZ7/Какой-вы-хомяк-с-большими-глазами Хомяков много не бывает 🐹 А какой из них ты? Присылай в комментариях!,173,538,13,0.024163568773234202
435,2024-03-29 07:40:45+00:00,"😱УЖЕ СЕГОДНЯ😱 Во сколько? ⏰18:30 Где? 📌Ленсовета,14. Актовый зал Ждём именно тебя на Творческом этапе «Мисс и Мистер ГУАП 2024» поддержать самых балдёжных активистов 💎Ксения Лелюх 💎Сергей Шевняков 💎Алина Котова 💎Никита Трошин Но если, к сожалению, ты не сможешь посмотреть в живую, то следи за участниками в телеграм канале проекта👇🏻 https://t.me/miss_mr_guap 💜Болей за четвёртый💜",380,621,16,0.02576489533011272
436,2024-03-30 13:27:16+00:00,Милые котики заряжают на хорошие выходные 🫶🏻 #милота,52,533,14,0.02626641651031895
437,2024-04-01 08:53:43+00:00,"❗️ВАЖНО❗️ В связи с тем, что наша Ксения Лелюх прошла в финал конкурса «Мисс и Мистер ГУАП 2024», она временно приостанавливает свою работу в профбюро 😞 Поэтому мы ищем нового председателя! 👀 Пиши в комментариях, кто годится на данную роль, мы срочно ищем замену 🚨",264,539,31,0.0575139146567718
438,2024-04-02 14:43:07+00:00,"✨Мы этого ждали✨ Самый уютный вечер от квартетника: 📆 6 апреля ⏰ в 19:00 📍пр-т Загородный 21/23 (парадная между аптекой и рестораном ""Мама Рома"") Куда идти знаем, значит, можно и продажу билетов открыть 💸 Цена - 190 ₽ Все, что вы любите, в одной форме: https://forms.yandex.ru/u/660488f25056901f0761dd9c/ При заполнении формы будьте внимательны: - солисты и дуэты могут исполнить не более 2х песен, группы - не более 3х - оплата принимается исключительно на Тинькофф - необходимо приложить не скриншот перевода, а чек об оплате - билеты не подлежат возврату, планируйте свои дела с умом - количество мест и выступающих ограничено! Кодовые данные для входа в парадную сообщат после оплаты 🤫 Вся более подробная информация в телеграм канале мероприятия: https://t.me/kvartetnik Скорее подписывайтесь! 🫶🏻",801,438,17,0.03881278538812785
439,2024-04-03 12:18:41+00:00,"😱Конкурс от активиста!😱 Мы загадали человека через его эстетику✨ Правила: 💜Пишите в комментариях свою догадку ( Имя и Фамилия) 💜 Из всех, кто напишет правильный ответ, мы выберем рандомным образом счастливчика 💜 Победитель получит подарок от этого активиста 🍀Удачи🍀",265,472,11,0.023305084745762712
440,2024-04-04 11:52:21+00:00,Сегодня отмечается Всемирный день крысы 🐀 ✨Поздравь своего дружочка!✨,69,641,24,0.0374414976599064
441,2024-04-06 08:01:29+00:00,"Доброе утро❤️‍🔥 Я - Алина Котова, студентка группы 2154, и сегодняшний день ты проведёшь вместе со мной😼 В видео я рассказала три факта о себе, бегом смотреть! *Ставь реакцию и следи за подготовкой Квартетника от лица главного организатора 🔥",241,476,26,0.0546218487394958
442,2024-04-06 10:44:48+00:00,Первый пункт на сегодня - зарядиться на успех!,46,426,4,0.009389671361502348
444,2024-04-06 16:25:13+00:00,Мы начали!,10,440,3,0.006818181818181818
