message_id,date_utc,text,text_len,views,reactions,engagement
4,2023-08-24 13:03:19+00:00,"Всем привет! На связи новый официальный телеграм канал 4 профбюро!🥳 Мы рады, что вы подписались на нас и благодарим за это❤ В этом балдежном тг канале будет много всего интересного,о чем конкретно расскажем в следующем посте🌸 Вас будет ждать познавательный, а главное и развлекательный контент🔥Мы хотим, чтобы эта площадка стала для вас местом общения! Поэтому оставляйте реакции,комментируйте и проявляйте активность🤩😉",419,631,29,0.04595879556259905
5,2023-08-24 14:50:48+00:00,"Итак, мы подготовили для вас рубрики, которые будут рассказывать об актуальных событиях, поднимать настроение, мотивировать, давать возможность высказывать свое мнения и задавать волнующие вопросы 😜 А чтобы было удобнее ориентироваться в постах, пользуйтесь этими хештегами 💗 #мотивация #милота #день_с #бекстейдж #вопрос_ответ #мем_недели Хештеги и темы могут меняться и добавляться, поэтому не забывайте возвращаться к этому посту 🥰",434,620,23,0.037096774193548385
6,2023-08-25 07:55:22+00:00,"Ты первокурсник 4 института? Значит ты обязан пойти на крутейшее мероприятие нашего профбюро - «Мансарда»✨ Вы уже знаете, что это такое из нашей группы в ВК, но здесь вы сможете принять участие в конкурсе, который пройдет уже очень скоро 👀 Победитель получит крутой приз, связанный с этим мероприятием 🔥 Подробную информацию о месте и времени,а также обязательную форму для заполнения вы получите от своих спутников в чатах ВК 🙌🏻",429,506,20,0.039525691699604744
7,2023-08-25 13:14:45+00:00,"💙 Давайте знакомиться! 💙 Про наше профбюро и про то, что будет в этом канале уже известно, но вас мы знаем не так хорошо🤔 Давайте вы расскажете в комментариях о себе одним словом и любым эмодзи 🤭 Например, о нас: семья4️⃣",221,415,10,0.024096385542168676
8,2023-08-26 08:41:24+00:00,"Специально для вас милый смешной котик, чтоб зарядиться на хорошие выходные 💗😍 #милота",86,382,26,0.06806282722513089
11,2023-08-27 11:27:27+00:00,Вчера прошла встреча с нашими первокурсниками❤️ Вы все просто супер!😍🔥,70,396,18,0.045454545454545456
13,2023-08-27 12:41:46+00:00,"Сегодня отмечается день русского кино🎬 Именно поэтому мы хотим узнать, как вы относитесь к новому русскому кинематографу🤔 Оставляйте скорее реакцию ! ❤️ - обожаю всем сердцем, особенно новые интересные сериалы 🙈 - смотрю сквозь закрытые глаза 🤩 - мечтаю сняться в фильме 😢 - вообще не смотрю Кстати, не забывайте, что в нашей ВК группе балдежной четверки есть рубрика кино-суббота! Всем советуем заглянуть и смотреть фильмы и мультфильмы вместе с нами ❤️😉",455,427,24,0.05620608899297424
14,2023-08-27 13:32:08+00:00,"😂 Мем недели! 😂 Мы думаем, что это будет самая любимая рубрика 🤭 Ловите смешную картинку! Так как сегодня день русского кино, то и мем соответствующий🎬 Каждое воскресенье будем выкладывать новый, но уже тот, что пришлете вы в комментарии! Чем больше реакций на вашем меме, тем больше шансов появиться в канале! 🔥 И не забывайте, что в следующее воскресенье 3 сентября 😉🗓️ #мем_недели",383,471,17,0.036093418259023353
15,2023-08-27 15:32:48+00:00,"‼️Внимание! Конкурс!‼️ Да, мы вас интриговали! И вот пора приоткрыть завесу тайны! 🤫 У вас есть шанс выиграть бесплатную проходку на мероприятие «Мансарда»✨😍 Правила очень просты: 💙 Подписаться на этот телеграм канал и на нашу группу в ВК 💙 Заполнить форму,которую пришлют вам в чаты ВК уже завтра 💙 Отправить «+» в комментарии 💙 Быть первокурсником 4 института Мы узнаем имя счастливчика уже очень скоро😉 Обязательно рассказывайте своим будущим одногруппникам про возможность пойти на нашу супер тусовку бесплатно!!! 🎉",519,547,22,0.04021937842778794
17,2023-08-27 16:46:23+00:00,Исит в сборе!🔥 Знакомимся и весело проводим время вместе❤️,58,407,10,0.02457002457002457
19,2023-08-28 08:02:58+00:00,🌸 Мотивация на неделю 🌸 «Все наши мечты могут сбыться - если у нас хватит смелости их осуществить» - Уолт Дисней. #мотивация,124,380,23,0.060526315789473685
20,2023-08-29 08:06:58+00:00,"💣Давайте устроим челлендж!💣 Лето почти закончилось, а значит пришло время вспомнить все яркие моменты жаркого сезона❤️ Опишите в комментариях тремя словами именно ваше лето 🌼",174,358,9,0.025139664804469275
21,2023-08-29 18:31:30+00:00,Мы на хайпе! Черный трешер! Или как это было в 2к17😍 Встреча активистов четверки прошла очень балдёжно. Оцените видео с той ночи ✨ Хочешь тоже на такие тусы вместе с нами? Тогда иди скорее в наш актив! 💙,203,375,28,0.07466666666666667
22,2023-08-30 06:56:07+00:00,"Доброе утро, студент🌞 Напоминаем, что уже завтра последний день лета, а это значит День знаний в нашем вузе 📚 Ждем всех 31.08 на Ленсовета,14 в 13:30 ! В честь этого праздника запускаем конкурс! Хотите записать кружок на канал со Дня знаний? Если да, то пишите в комментариях какой у вас будет образ или интересный аксессуар✨ Мы выберем самый стильный и напишем вам в лс! Принимайте скорее участие🔥",398,357,10,0.028011204481792718
26,2023-08-31 10:31:34+00:00,Наша команда четверки ждет вас на Дне знаний!,45,316,14,0.04430379746835443
28,2023-08-31 11:07:47+00:00,Самый лучший?! Балдёжный четвертый! Все первокурсники супер заряжены 🔥,70,306,0,0.0
31,2023-09-01 07:44:45+00:00,"Поздравляем с первым учебным днем в этом семестре! 🥳🎉 Желаем легких пар, понимающих преподавателей и помогающих одногруппников ✨ Начало нового семестра означает активную работу профбюро после летнего сезона! Еще больше мероприятий, еще больше возможностей для вас 🤩 Давайте все хорошо постараемся в этом учебном году 💗💫",319,334,23,0.0688622754491018
33,2023-09-01 08:46:28+00:00,Всех ждём на ПРОФ.Старте в сквере Северная роща по пути в корпус на Гастелло и на Ленсовета❤️,93,327,9,0.027522935779816515
34,2023-09-01 17:13:06+00:00,"Интересно,а как прошел ваш первый учебный день в этом году 🤔 Оставляйте реакцию! 🔥- весь день на парах 😍- у меня сегодня выходной,я избранный 😂 - не на учебе,а на работе!",170,318,66,0.20754716981132076
35,2023-09-02 08:04:22+00:00,Милота на хорошие выходные💗 Ставь реакцию и получай позитивный настрой! #милота,79,325,25,0.07692307692307693
36,2023-09-02 13:56:45+00:00,А вот и бэкстейдж с фотосессии главных организаторов 😍 Получились очень красивые снимки! Но вы их увидите чуть позже 😉,118,325,27,0.08307692307692308
37,2023-09-03 08:02:02+00:00,#мем_недели,11,309,16,0.05177993527508091
38,2023-09-03 10:10:51+00:00,🥳Поздравляем победителя конкурса🥳 @Arsen1y1 Ченгаев Арсений получает от нас бесплатную проходку на мероприятие «Мансарда»❤️‍🔥,125,316,14,0.04430379746835443
39,2023-09-03 16:03:33+00:00,Видео со Дня знаний 👀 Как вам такие мини бэкстейджи с мероприятий? Оцените реакцией или комментарием! P.S.Музыка приурочена к сегодняшнему дню 😉,144,332,20,0.060240963855421686
40,2023-09-04 08:36:38+00:00,"🌸 Мотивация на неделю 🌸 «Верите ли вы, что можете добиться успеха, и если верите, что не можете, то в обоих случаях вы правы» - Генри Форд. #мотивация",150,337,17,0.050445103857566766
41,2023-09-04 14:14:48+00:00,"❓Вопрос/Ответ ❓ Давайте вместе совершенствоваться и узнавать новое! 🔥🤔 Задавайте в комментариях свои вопросы связанные с профкомом, пишите предложения и замечания! Мы хотим получать от вас обратную связь и разбираться в непонятном вместе! 💞 В отдельном посте этой рубрики мы ответим на самые волнующие вопросы и разберем ваши идеи 🤓 Скорее пишите комментарии!⭐️ #вопрос_ответ",375,339,10,0.029498525073746312
42,2023-09-05 12:04:07+00:00,Бэкстейдж с фотосессии! Часть 2😻🔥❤️‍🔥,37,331,26,0.07854984894259819
43,2023-09-06 07:45:32+00:00,❗️КОНКУРС❗️ Разыгрываем третью и последнюю бесплатную проходку на мероприятие «Мансарда» 🤩 Не упусти такой крутой шанс и скорее участвуй! Условия : 💗 Быть первокурсником балдёжного четвертого 💗 Быть подписанным на нашу группу ВК 💗 Быть подписанным на наш телеграм канал 💗 Заполнить форму-заявление на мероприятие 💗 Записать видео-кружок и отправить в комментариях! Тема: «Что я умею лучше всего!» Старайтесь быть креативными и оригинальными ✨ Итоги подведем уже завтра вечером!,477,351,19,0.05413105413105413
45,2023-09-07 08:56:57+00:00,"Расскажем вам про нашу самую интересную рубрику « День с…» 🔥 Завтра весь день с вами на связи будет наш самый любимый председатель Ксения Лелюх ❤️ Узнаем, как она проводит свой день, увидим кружочки записанные здесь и сейчас! Не пропустите! 🤩 Самое главное! Каждый из вас сможет вести целый день наш канал😳 А выбирать мы будем самых активных людей в нашем профбюро 💗 #день_с",374,343,13,0.037900874635568516
46,2023-09-07 15:49:43+00:00,Объявление результата конкурса! Кружок Маркиянова Сергея понравился нам больше всего! Победитель заслуживает свою бесплатную проходку! Поздравляем 🎉,148,350,19,0.054285714285714284
47,2023-09-08 07:14:18+00:00,"Всем доброе утро! И тем, кто ещё только открывает глаза, и тем, кто уже пошёл на пары. ☀️🌸 Отправляй реакцию, как ты сегодня проведёшь этот день! 🔥 - буду продуктивным и сделаю много дел 🤓 - пойду на пары 😎 - у меня сегодня выходной, буду отдыхать 👨‍💻 - пойду на работу 😢 - буду сдавать долги Лично у меня сегодня настроение - 🔥🤓😢 Желаю вам хорошего дня, дорогие друзья! (Ксюша)",378,319,69,0.21630094043887146
48,2023-09-08 09:49:58+00:00,"Встречайте человека, который ведёт этот замечательный канал. Дина!🥰 (Она меня кормит и ходит со мной на пары😈)",110,321,34,0.1059190031152648
49,2023-09-08 12:50:28+00:00,"Хотелось бы посоветовать вам классное место, где можно вкусно покушать! 😇 💜 Fasta Pasta - Площадь Труда, 4Б Итальянская кухня, приятный интерьер и близость к корпусу на Большой Морской. Разве всё это не повод зайти сюда? 🥰",222,311,24,0.07717041800643087
52,2023-09-08 18:01:21+00:00,"Провели сегодня собрание и знакомство с профоргами, старостами и кураторами! В очередной раз убедилась, что наши ребята просто супер! 🔥🔥🔥",137,315,34,0.10793650793650794
53,2023-09-08 19:03:13+00:00,"Сегодня мы делились интересными фактами о себе😱 До 9 класса я хотела быть дизайнером и даже закончила художественную школу, но потом мне сказали, что в физмате крутятся деньги. Теперь я технарь. Денег, к сожалению, пока нет. 😬 Было бы интересно узнать и ваши интересные факты о себе, дорогие подписчики. Пишите в комментариях о них. Давайте станем ближе друг к другу! 😊 Сладких снов вам! Спасибо, что провели день со мной❤",422,349,16,0.045845272206303724
54,2023-09-09 09:12:45+00:00,Этот пёсик дарит вам цветочек и заряжает милотой на хорошие выходные🌸 #милота,77,368,32,0.08695652173913043
55,2023-09-10 08:21:30+00:00,#мем_недели,11,346,19,0.05491329479768786
57,2023-09-10 14:52:10+00:00,Начинается наша самая балдёжная Мансарда🤩 Ребята из первого потока нашей вечеринки уже готовы зажигать 🔥,104,368,5,0.01358695652173913
61,2023-09-10 21:17:59+00:00,Ночной поток мансарды начинает собираться 🔥,43,381,12,0.031496062992125984
62,2023-09-11 00:19:10+00:00,Один из ярких моментов этой ночи 😍,34,425,22,0.05176470588235294
63,2023-09-11 08:32:25+00:00,"🌸 Мотивация на неделю 🌸 Не корите себя за совершенные ошибки. Научитесь распознавать в них ценные уроки, которые обязательно пригодятся вам в будущем, чтобы больше не наступать на одни и те же грабли. Смотрите на ошибки как на опыт, а не как на то, из-за чего стоит перестать что-либо делать. #мотивация",303,407,17,0.04176904176904177
64,2023-09-11 13:18:50+00:00,"Дорогой первокурсник, который был на нашей чудесной Мансарде! Нам стало интересно, как ты провел это время 🤔 🔥- зажигал ярче всех! ❤️- познакомился и пообщался с каждым! 😎- лучше всех выполнил задания на станциях! 🎉- просто круто и весело провел время! 👍🏻- Я не отдыхал, я был организатором! Ждем твоей реакции 🫶🏻",313,375,64,0.17066666666666666
68,2023-09-12 14:58:56+00:00,Вы готовы получать огромную порцию заряда с Мансарды?! Ловите первый видеоклип 😻,80,473,33,0.06976744186046512
69,2023-09-13 09:10:17+00:00,"Поздравляем с Днем программиста!🎉💻 Желаем тебе в твой профессиональный праздник мегабайты хорошего настроения, гигабайты везения и терабайты успеха! Этот праздник создан для 4 института, отмечать обязательно!🔥",209,433,40,0.09237875288683603
70,2023-09-14 08:12:53+00:00,Встреча с нашими первокурсниками на станции в рамках фестиваля объединений ❤️,77,431,23,0.05336426914153132
72,2023-09-14 11:47:42+00:00,"Уже прошла половина первого учебного месяца в этом году! Как быстро летит время! До лета 2024 осталось всего 260 дней ) Но сейчас мы надеемся, что вы вливаетесь в учебный процесс. И стало интересно, как у вас обстоят с этим дела? 🔥 - стараюсь скорее сделать все задания 🎉- настроен на продуктивный семестр ❤️- пока не до учебы, хожу на мероприятия профкома 👍🏻 - работаю параллельно с учебой 😢- успел заболеть Ждем реакции!",422,419,58,0.13842482100238662
73,2023-09-15 07:40:06+00:00,А вот и долгожданное второе видео с самыми ярки моментами Мансарды 🔥,68,465,29,0.06236559139784946
74,2023-09-16 09:06:11+00:00,Ловите милоту на хорошие выходные 🌸 #милота,43,395,24,0.060759493670886074
76,2023-09-16 19:59:20+00:00,«Деловое» собрание главарей перед сном ✨ Готовим для вас различные проекты и мероприятия 👀,90,439,30,0.0683371298405467
77,2023-09-17 12:00:05+00:00,#мем_недели,11,402,21,0.05223880597014925
78,2023-09-18 09:16:55+00:00,🌸 Мотивация на неделю 🌸 #мотивация,34,420,18,0.04285714285714286
79,2023-09-19 13:03:46+00:00,"❓Вопрос/Ответ❓ 1. Что такое профсоюз? 🤔 - Первичная профсоюзная организация - это объединение в вузе, которое занимается защитой прав и интересов студентов. 2. Какие плюсы состоять в профсоюзе? 😍 - Всегда под защитой - Бонусы - Скидки - Возможности - Крутые мероприятия и проекты - Путешествия - Участие в конкурсах регионального и Всероссийского масштабов - Развитие soft-skills 3. Почему профсоюз - это лучшее место на свете? 💕 -Может быть, потому что здесь лучшие люди на свете?) А ответила на вопросы наша великолепная председательница Ксения 🔥 #вопрос_ответ",562,382,17,0.04450261780104712
80,2023-09-20 09:45:53+00:00,"В Петербурге наступают холода, а это значит, что нужно искать способы согреться дождливой осенью 🍂 Предлагаем всем поставить реакцию «🔥» на этот пост. Давайте поделимся теплом друг с другом!",190,340,48,0.1411764705882353
81,2023-09-20 12:12:33+00:00,Нашли себя?😎,12,432,29,0.06712962962962964
83,2023-09-20 15:32:40+00:00,Начинается собрание активистов нашего профбюро 🔥,48,378,16,0.042328042328042326
84,2023-09-21 12:52:11+00:00,Какой ты сегодня активист?🤔 Отправляй скорее скриншот в комментарии!,68,440,14,0.031818181818181815
85,2023-09-22 14:54:29+00:00,Много милоты на хорошие выходные💗🌸 #милота,42,327,23,0.07033639143730887
93,2023-09-24 12:27:30+00:00,#мем_недели,11,478,15,0.03138075313807531
94,2023-09-25 09:48:10+00:00,"🌸 Мотивация на неделю 🌸 Получение желаемого требует действий. Вам нужно осознать, какие привычки не помогают вам и не поддерживают ваши мечты. И как только вы признаете, что вам нужны перемены, вы можете медленно начать двигаться вперёд. ∼ ⋆∘ ✧ ∘⋆ ∼ #мотивация",260,474,16,0.03375527426160337
95,2023-09-26 10:15:23+00:00,"Интересный факт! Вы знали, что сегодня всемирный День контрацепции!😏 Пусть ваше знание о контрацепции всегда будет на высоте, как ваша академическая мудрость! Помните, что планирование и ответственность всегда в моде, как и здоровое чувство юмора. Пусть каждый ваш день будет так же надежно защищен, как и корпус на БМ с новой системой прохода. С наилучшими пожеланиями и безопасными учебными приключениями! 😄📚🎉",411,532,30,0.05639097744360902
96,2023-09-27 10:38:10+00:00,"А вы понимаете, как это все может не надо быть 🤔 Лично мы не понимаем!😻",71,388,18,0.04639175257731959
98,2023-09-29 11:48:40+00:00,"❗️Важно❗️ Нам стало интересно узнать, что больше всего привлекает в профбюро именно вас!?🤔 Ставьте скорее реакцию и помогайте нам подвести статистику! ❤️- Тут классные люди, которые заряжают! 🔥 - Обожаю веселиться на мероприятиях 👍🏻 - Защищать права студентов 😍 - Организация мероприятий/проектов -моё все! 🥰 - Чувство поддержки, мне всегда готовы помочь! ✨ - Свой ответ в комментариях",385,368,46,0.125
