message_id,date_utc,text,text_len,views,reactions,engagement
879,2024-09-29 18:37:21+00:00,"Вот и подошли к концу выходные За спиной у нас первый месяц осени, но впереди ещё много учёбы, мероприятий и ярких событий в студенческой жизни✨ Готовы к новой рабочей неделе? Ставьте реакцию «🔥», если да!",205,468,42,0.08974358974358974
891,2024-09-30 14:00:20+00:00,✨ВСЕВИДЯЩИЙ ПОНЕДЕЛЬНИК✨ Скорее читай что же тебе пророчат звёзды на этой неделе ✨,82,473,0,0.0
892,2024-10-01 11:28:19+00:00,"Это мы на открытие СТЛ, сейчас уже дома ✨ Вчера прошло открытие Всероссийского конкурса ""Студенческий лидер"", где Санкт-Петербург представляет Вострикова Анна Петровна, заместитель председателя ППОСА ГУАП. А сегодня проходит второй конкурсный день, на котором участники уже показали себя в этапе «Автопортрет» Желаем только победы Анне, мы верим в неё и знаем, что всё получится 🔥❤️",382,694,18,0.025936599423631124
897,2024-10-01 17:13:18+00:00,🔥 Профорка в деле 🔥 Мы начинаем наши занятия со знакомства с направлениями и друг с другом✨ У тебя есть последний шанс подать заявку 👉🏻 https://docs.google.com/forms/d/e/1FAIpQLSdIMNbgYMKsRzf5PosNLvgKgrWII3sqUNqYy2qwwadoEKpA8w/viewform?usp=sf_link 💜Дальше-больше💜 Следите за новостями,284,812,23,0.02832512315270936
901,2024-10-05 12:20:41+00:00,"Теперь мы криминальные авторитеты😎 На самом деле балдёжные активисты принимают участие не только в мероприятиях четвёрки, но и во всём вузе! Так вчера ребята примерили на себя роль бандитов и федералов в квесте от ПБ2 Спасибо, что пригласили! Это было невероятно интересно и атмосферно 🧡💜",288,526,33,0.06273764258555133
913,2024-10-07 12:30:10+00:00,✨ВСЕВИДЯЩИЙ ПОНЕДЕЛЬНИК✨,24,569,0,0.0
914,2024-10-10 09:40:51+00:00,"✨О том как мы на посвяте были✨ 8 октября наши первокурсники балдёжной четвёрки отрывались на посвящение, теперь они самые настоящие студенты 🧑‍🎓 А наши активисты и спутники тоже не упустили возможность попасть на мероприятие и повеселиться! Мы были везде: и организовывали, и вели, и волонтерили, и награждали, но главное - пели и танцевали🤩 Также поздравляем группу 4428 со званием лучшей группы нашего института! Вы большие молодцы и заслужили эту победу! 🥳",459,456,31,0.06798245614035088
920,2024-10-12 08:40:36+00:00,"Рабочая неделя закончилась, а значит настало время отдыха! Поэтому ловите милоту на хорошие выходные💖 #милота",109,412,24,0.05825242718446602
921,2024-10-13 10:34:08+00:00,"Сегодня отмечается День балования себя 🩷 Психологи считают одним из способов достижения гармонии и внутреннего равновесия умение человека баловать себя. Поэтому обязательно порадуйте себя сегодня, вкусно покушайте и займитесь любимым делом 💜",241,442,21,0.04751131221719457
922,2024-10-13 15:41:02+00:00,Наша «Академия Профорка» идет уже две недели! ✨ Пришло время подводить промежуточные итоги: 🟣зарегистрировались 55 человек 🟣проведено 7 занятий 🟣4 очные встречи 🟣более 2-х тысяч сообщений в чатах академии 🟣сделано и проверено много домашек 🟣просто весело и полезно проводили время Следите за новостями! Совсем скоро будем публиковать работы наших учеников! 💜Дальше-больше💜,372,394,19,0.048223350253807105
936,2024-10-14 12:00:13+00:00,✨ВСЕВИДЯЩИЙ ПОНЕДЕЛЬНИК✨ Как вам ваше предсказание на неделю? Мне вот уже второй раз подряд предсказывают сложную и напряженную неделю 🫠,136,477,0,0.0
937,2024-10-15 15:53:15+00:00,"♻️Сдать макулатуру - это не просто выбросить мусор, это сделать мир чуточку лучше! 🌎 В рамках акции «Бумажный Бум» мы подготовили три весомые причины, почему стоит сдать бумагу: 1️⃣Сохранение лесов: Производство новой бумаги требует огромного количества древесины, а значит, вырубки ценных лесов. Сдача макулатуры - это шаг к уменьшению спроса на новую древесину и сохранению лесных массивов, которые являются домом для множества животных и растений🌳 2️⃣Экономия ресурсов: Переработка макулатуры требует значительно меньше энергии и воды, чем производство новой бумаги. Это помогает снизить нагрузку на окружающую среду и сохранить ценные ресурсы нашей планеты💧 3️⃣Снижение загрязнения: Изготовление бумаги - это ресурсоемкий процесс, который сопровождается выбросами вредных веществ в атмосферу. Переработка макулатуры позволяет сократить объемы загрязнения и сделать воздух чище😶‍🌫️ А подробнее, где сдать бумагу читайте в посте! Не забывайте, что каждый может внести свой вклад в сохранение нашей планеты! Сдавайте макулатуру, и вместе мы сделаем мир лучше! 🌿",1062,511,13,0.025440313111545987
938,2024-10-16 16:03:19+00:00,"Мы начинаем марафон интервью🤩 Ребята, которые учатся в Профорке на направление СММ уже готовы поделиться с вами своими первыми работами! А вас просим поддержать их реакциями и комментариями, ведь они старались ❤️",212,438,14,0.0319634703196347
939,2024-10-16 16:03:41+00:00,"А открывает наш марафон сегодня Виктория Майкова из группы 4434 Она взяла интервью у Михаила Дрофичева, который является активистом нашей четвёрочки! Давайте же посмотрим 👀",172,484,25,0.05165289256198347
940,2024-10-17 15:30:28+00:00,"Продолжаем марафон! И следующая работа от Ильи Полозкова группа 4327 Он взял интервью у спутника, волонтера и просто мега-активиста Никиты Кондаурова👇",150,421,9,0.021377672209026127
941,2024-10-17 15:30:41+00:00,"Илья - ""Привет! Я видел тебя в военной форме на БМ, расскажи пожалуйста, через что тебе пришлось пройти, чтобы попасть на обучение в ВУЦ?"" Никита - ""Привет! Попасть на военную кафедру довольно интересное испытание, иногда было ощущение, что я появляюсь в военкомате чаще, чем на парах. Стояние в очередях по часа 4, а потом объявление, что у них обед, и вообще оказывается, что сегодня сокращенный день. Нормативы сдавать было достаточно легко, потому что всё проходило в один день. 3 километра бежать сложно, но в какой-то момент ты понимаешь, что не чувствуешь ног, и у тебя задача просто добежать, контролируя дыхание. Я поступил и в принципе рад😇"" Илья - ""Расскажи, пожалуйста, какой ещё внеучебной деятельностью и почему ты занимаешься?"" Никита - "" Изначально я пошёл в фотостудию, думая, что я что-то знаю в фотографии, но оказалось, что есть ещё много разных моментов и нюансов, которые познаешь только при практической разнопрофильной съемке. ВУЗ предоставляет оборудование и Технические Задания, с которым ты можешь фоткать интересные для тебя мероприятия, и получить баллы на повышенную стипендию. Я фоткал внутривузовские, городские и всероссийские мероприятия, а именно: концерты, слеты, дни открытых дверей, социальные проекты, посвящения, спортивные мероприятия и т. д. Это всё отличный опыт для фотографа и активиста, так как при этом появляется еще куча новых связей, знакомых, друзей, что меня очень воодушевляет. Даже планирую стать фотографом📸 Также я стал волонтером, что дало мне доступ к различным классным мероприятиям. Две мои летние недели прошли на Алых Парусах, ВК фесте, Выпускных ГУАП и Жарить Фесте. Это было незабываемо и точно стоило того. После зимы я записался в студенческий сельскохозяйственный отряд Колосс… И вот после пары десятков просто прекрасных мероприятий весной-летом, я стою в горах Краснодарского края, собирая вкуснейший виноград Абрау Дюрсо. Так это ещё и в лучшей компании друзей, с которыми мы сплотились еще осенью. Мы сами проводили много мероприятий, путешествовали, жили и наслаждались всем этим полтора летних месяца. Сейчас я стал Мастером данного отряда, в этом учебном году я буду достаточно важным и ответственным человеком, который сделает всё, чтобы отряд жил и становился только лучше!🍇""",2251,505,36,0.07128712871287128
944,2024-10-18 13:16:37+00:00,"Последняя на этой неделе, но не в нашем марафоне работа Аллы Гончаренко группа 4416 А интервью дал ответственный за профоргов балдёжной четвёрки - Денис Кольцов👇",161,408,20,0.049019607843137254
945,2024-10-18 13:16:48+00:00,"Алла: Привет, Денис! Можешь рассказать о том, кем ты являешься в Академии Профорка? Денис: Я являюсь координатором проекта и куратором направления работы с профоргами. Алла: Для чего нужно твое направление в Академии Профорка? Почему его стоит посетить? Денис: Оно нужно для развития профессиональных и мягких навыков профоргов и активистов. Профоргам стоит посетить это мероприятие, чтобы узнать больше о своей роли в группе и избежать трудностей, а обычным активистам можно больше узнать о своих правах и обязанностях, вузе и т. д. Конечно, иметь крутого профорга - это хорошо, но уметь защищать свои права самому не будет лишним. Также ребята развивают свои навыки коммуникации, лидерства, работы в команде и другие полезные в жизни навыки. Алла: Кто создавал программу обучения на твое направление? Какова твоя роль в создании занятий? Денис: Программу обучения создавали мы с Соней. Более интерактивные лекции писал я, а правовые - Соня. За основу мы брали личный опыт и документы, например, ФЗ-273. Алла: Почему ты решил курировать направление профоргов? Денис: Потому что Профорка - моё любимое мероприятие, это целая школа жизни, в которой я много познал и нашел себе верных друзей. Видеть, как профорги образуют новую компанию, в которой все друг друга уважают и дружат - это прекрасно. Алла: Какие советы можешь дать людям, которые хотят стать активистами профсоюза? Денис: Терпение, только терпение)",1410,558,30,0.053763440860215055
946,2024-10-20 12:53:32+00:00,"Вы уже поймали этот осенний Хеллоуинский вайб? 🎃 Мы вот да! Ставьте реакцию, нам интересно, как у вас дела! 🎃 - тоже наслаждаюсь осенью 😢 - на рабочем вайбе 🧑🏻‍💻 - у меня эстетика учебы 🔥 - пытаюсь не заболеть, но пока не очень получается ❤️ - просто кайфую и отдыхаю #милота",275,499,34,0.06813627254509018
956,2024-10-21 14:23:12+00:00,✨ВСЕВИДЯЩИЙ ПОНЕДЕЛЬНИК✨ Какой знак из сегодняшней подборки доволен своим предсказанием на неделю? ✨,100,475,0,0.0
959,2024-10-23 13:05:07+00:00,"✨Марафон продолжается✨ Ловите следующее интервью, которое подготовил для вас Паша Шихирин из группы 4417 ⬇️",107,347,6,0.01729106628242075
960,2024-10-23 13:05:25+00:00,"Сегодня были объявлены результаты «Человек года 2024». Им стал студент нашего института Сергей Шевняков! В рамках нашей студенческой газеты мы решили взять у него интервью Начнём, пожалуй, с главного. Сергей, расскажи, пожалуйста, как ты стал заместителем председателя четвёртого Профбюро? Что даёт тебе эта должность? — Я очень давно состою в активе профбюро. В начале своего второго курса стал ответственным по разным направлениям: к ним относились Дискорд и турниры в нашем профбюро. В течение года я продолжал активно работать. Мы с Ксюшей хорошо общаемся, понимаем друг друга, поэтому нам комфортно работать вместе. Когда нужно было выбирать её нового заместителя, вся команда была согласна с тем, что я подхожу на эту роль, и к концу второго курса я им стал. Какие задачи в активе ты выполняешь? — Я являюсь проектным менеджером в нашем ПБ. Если кратко сказать, то контролирую реализацию проектов. Также сам организовываю любительские турниры по играм для студентов нашего ВУЗа и участвую в организации некоторых вузовских мероприятий. Теперь давай поговорим о досуге. Как ты проводишь своё свободное время? — В свободное время занимаюсь саморазвитием, могу погулять с друзьями или поделать что-то связанное с творчеством. А когда хочется просто отдохнуть, то играю в компьютерные игры со своими друзьями. Какие у тебя есть хобби и увлечения? Что хотел бы освоить в будущем? — Люблю заниматься видеомонтажом. От этого получаю огромное удовольствие, так как могу перенести в видео свои идеи и виденье чего-либо для других людей. Кроме того, когда есть возможность, я играю на музыкальных инструментах. Со временем мне бы хотелось попробовать освоить игру на скрипке. Из рубрики ""ЛЕГЕНДЫ РЕКОМЕНДУЮТ"" мы знаем о твоих любимых фильмах, сериалах и компьютерных играх. Что ты можешь сказать насчёт книг? Любишь ли ты читать? Если да, то какие книги являются твоими любимыми? — Честно говоря, в своей жизни я прочитал не так много книг. В основном это были произведения из школьной программы и некоторые книжки фэнтези. А так мне больше нравится читать статьи на различные темы. Немного обо всём остальном. Твоё любимое место в Петербурге? — Новая Голландия! Наверное, одно из первых мест, которое я посетил в Петербурге. Она расположена рядом с главным корпусом нашего ВУЗа, так что в приятную погоду находиться в Новой Голландии — одно удовольствие. Без чего ты не можешь обойтись ни дня? — Музыка. Не могу представить, чтобы я делал без неё. Можешь выделить 3 своих самых лучших качества? — Доброта, ответственность и отзывчивость. Расскажи лучший совет, который тебе когда-либо давали. — Никогда не надо упускать возможности, которые тебе предлагает эта жизнь! Не всегда будешь знать, принесёт ли тебе это пользу, но если не попробовать, то, возможно, будешь об этом сожалеть. И напоследок расскажи, пожалуйста, об одной самой весёлой или запоминающейся истории, которая произошла с тобой во время твоей студенческой жизни. — Не могу выделить какую-либо одну историю, потому что их очень много! Но точно могу сказать, что все они происходят у нас в профбюро!",3062,462,34,0.0735930735930736
961,2024-10-24 13:46:25+00:00,Новый день – новое интервью!⭐️ Лебедева Кристина из группы 4328 делится своей работой⬇️,87,380,2,0.005263157894736842
962,2024-10-24 13:46:37+00:00,"🍂 Осень уже в полном разгаре, и хотя за окном падают листья, давайте ненадолго вернемся в теплые летние дни! ☀️ Наши студенты провели это лето с пользой, активно участвуя в работе в Приемной Комиссии нашего вуза. Мы взяли интервью у Алиева Рауфа, чтобы подробно рассказать вам про эту замечательную возможность. Почему ты решил пойти работать в ПК? «Решил пойти работать в ПК, так как хотел подзаработать. Привлекло то, что работа в самом ВУЗе и можно самому составлять график, а значит я смогу работать и вовремя сессии.» Какие у тебя были обязанности? Чем ты занимался? «Я был оператором данных и экзаменатором очных экзаменов. В первом случае я принимал документы и осведомлял абитуриентов о всех процессах в вузе. Во втором случае, я проводил экзамены, отвечал за посещаемость абитуриентов, за исправность техники.» Так ли сложно работать в ПК, как все думают? «Многие считают, что работать в ПК трудно, поскольку не знают, что нужно делать. Однако, во время работы при появлении трудностей можно всегда спросить у коллег, они подскажут и всегда помогут. Также всегда можно было воспользоваться сайтом , в котором все подробно расписано и легко найти любую информацию.» Что больше всего понравилось тебе на работе в ПК? «Понравилось то, что были хорошие условия: удобные кресла, два монитора, кондиционер, под рукой всегда были необходимые канцелярские принадлежности. Больше всего мне понравилось, что в ПК можно обрести новые знакомства.» Советуешь ли ты другим идти работать в ПК? «Да, советую, одна из самых лучших мест работы!»",1536,487,15,0.030800821355236138
963,2024-10-25 16:41:14+00:00,"Продолжаем марафон! Последняя на этой неделе работа Матвеева Дмитрия из группы 4427 Алеся Лопаткова – спутник, дизайнер и активистка ответила ему на вопросы 👇",158,419,11,0.026252983293556086
