message_id,date_utc,text,text_len,views,reactions,engagement
1439,2025-05-12 16:31:29+00:00,"42 причины ждать завтрашний день 🔥 Готовится что-то невероятное, ведь Профбюро №2 и Профбюро №4 объединяют усилия ради... кое-чего очень крутого! 🤫 Заинтригованы? Тогда пристально следите за нашими каналами, чтобы не упустить самое интересное! 🤩 Уже завтра, 13 мая, вы все узнаете... 🚀",285,434,30,0.06912442396313365
1441,2025-05-13 08:40:20+00:00,"ЭТО ВТОРОЙ!💥 Или четвёртый? 🟧🟧🟧🟧🟧🟧🟧🟧🟧🟧🟧 Второе Профбюро (это которое творит только добро) сегодня раздаст стиля в гостях у Балдёжного четвёртого! 💜 Следи за выполнением заданий в наших каналах, не пропусти самое интересное! 👀",225,500,53,0.106
1442,2025-05-13 10:50:46+00:00,"Будни студента наполнены не только яркими эмоциями, но и стрессом ✨ Поэтому время расслабиться! 😌 Задание 1: раскрасить касатку, получить удовольствие",150,479,31,0.06471816283924843
1444,2025-05-13 12:02:53+00:00,"Один Денис — это конечно хорошо, но два пикми Дениса — ещё лучше! Задание 2: сделать картонную фигуру председателя ПБ4 и написать ему пожелания на оранжевых и фиолетовых стикерах 💜🧡",181,466,32,0.06866952789699571
1446,2025-05-13 12:30:34+00:00,Равноценный обмен — Аня Буш на Вику Майкову (и обратно. Аня нам самим нужна ещё) 👀 Задание 3: обмен активистами! 🟧🟧🟧🟧🟧🟧🟧🟧🟧🟧🟧 И всё–таки Вике идёт FF7500 🧡,154,477,35,0.07337526205450734
1448,2025-05-13 13:35:06+00:00,"Ну ооооочень милое 4 задание: покрасить руки в фиолетовый и ff7500, сфотографироваться и сделать коллаж 💜🟧🟧💜",108,516,45,0.0872093023255814
1449,2025-05-13 14:05:19+00:00,Бонус–задание перед самым интересным: спеть неизданную песню Балдёжного четвёртого 🟧🟧🟧🟧🟧🟧🟧🟧🟧🟧🟧 А кто спел это для нас? Главный исполнитель направления «электроника и наноэлектроника» — Никитка–накидка 💪,202,501,32,0.06387225548902195
1451,2025-05-13 15:00:08+00:00,"😱 Гвоздь программы 😱 Легендарное 5 задание для не менее легендарного Кости Суть: повторить видео, восхититься танцевальным талантом Кости, красиво закрыть сегодняшний день",171,1105,45,0.04072398190045249
1452,2025-05-13 16:26:55+00:00,"Вот и подошла к концу наша коллаборация с Наикрутейшим вторым! 🟧🟧🟧🟧🟧🟧🟧🟧🟧🟧🟧 Это было ярко, это было весело, это было легендарно! Спасибо ребятам за отдачу и эмоции! 💜 Какое задание понравилось больше всего? 👀 Делитесь впечатлениями от нашего тандема в комментариях!",264,523,44,0.0841300191204589
1454,2025-05-14 10:05:52+00:00,"Твой шанс изменить историю! 🌍 Хочешь почувствовать себя настоящим лидером сверхдержавы? Держать в руках экономику, армию и дипломатию? Тогда стратегическая игра «Мировое господство» — для тебя! Что тебя ждёт? 🤩 Стратегия и власть: Развивай экономику, укрепляй армию и защищай свои города. 🤩 Дипломатия и интриги: Заключай союзы, веди переговоры или иди на хитрость — победа зависит от твоих решений! 🤩 Командная игра: Объединяйся с друзьями и веди свою страну к мировому господству. 🤩 Полная свобода: Придумай название, флаг и стиль управления — прояви креативность! 🎯 Цель: Поднять уровень жизни своей страны выше всех и стать сверхдержавой №1! Обязательно регистрируйся по ссылкам 👇 https://goup.guap.ru/lk/events/8749 https://forms.yandex.ru/u/67fcf43cf47e73b686438561/ Собирай команду и веди свою державу к победе — или проиграешь в борьбе за власть! ⚔️",857,1066,21,0.019699812382739212
1455,2025-05-19 15:12:16+00:00,"✨ Новая неделя - новые возможности ✨ Пусть эта неделя будет наполнена вдохновением, энергией и позитивными эмоциями. Каждый день - это шанс стать лучше, сделать что-то полезное и приблизиться к своей мечте. Не бойтесь трудностей, они делают нас сильнее! 🤗 Желаем вам продуктивной и счастливой недели 💜",301,564,27,0.047872340425531915
1456,2025-05-21 13:34:34+00:00,"💫 БАЛДЁЖНЫЕ ТЕСТЫ 💫 Это второ-кхм, то есть, это уже третий тест нашей рубрики! Быстрее проходите по ссылке и узнайте, какая вы лягушка 🐸 И не забудьте скинуть свой результат в комментарии! ❤️‍🔥",193,599,23,0.038397328881469114
1457,2025-05-28 15:30:04+00:00,"Новый ребус для самых внимательных! 🤔 Попробуй разгадать и напиши ответ в комментариях — посмотрим, кто первый справится! 🥇 Подсказка: запятые – это буквы, которые надо взять из слова 😉",185,575,16,0.02782608695652174
1459,2025-05-29 17:49:12+00:00,Маленький праздник и большой повод для радости 🎉 Вчера сестре председателя Дениса Кольцова исполнилось 4 года! Он поздравляет её с днем рождения и желает крепкого здоровья и счастья ✨ Пусть каждый день будет наполнен улыбками и яркими моментами! 🎂,247,618,73,0.11812297734627832
1460,2025-06-01 11:27:14+00:00,"Крупное собрание нашего профбюро 🐬 Вчера состоялось собрание профбюро №4, на котором подвели итоги учебного года, обсудили достижения и наметили планы на следующий семестр! ☀️ Впереди много интересного ❤️‍🔥",206,616,26,0.04220779220779221
1462,2025-06-04 17:45:38+00:00,"Вы же помните что означает буква ""А"" в аббревиатуре нашего университета? Конечно же ""аэрокосмический""! В честь этого предлагаем вам пройти сегодняшний тест 😊 И обязательно оставляйте результаты прохождения в комментариях 🌎",222,527,20,0.03795066413662239
1464,2025-06-06 14:47:55+00:00,"Июнь начался с крутых мероприятий! 🔥 Наше профбюро заняло 1 место в рейтинге всех объединений ГУАП, в честь чего ребята получили бесплатные билеты на ""Петровские ассамблеи 3.2.2"" и 1 июня оторвались на концерте. Было очень круто и весело! 🐬 Также 4 июня активисты профбюро собрались вместе в антикафе, чтобы хорошо провести время. Чай, настольные игры и хорошая компания – что может быть лучше? ☕️ Вместе мы сила! 💪",415,656,31,0.04725609756097561
1466,2025-06-09 15:00:22+00:00,"Начало сессии не повод для грусти 😊 Дождливый день — отличный повод сосредоточиться и погрузиться в учёбу. Сессия уже началась, и это твой шанс показать лучший результат. Не позволяй погоде влиять на настроение: настоящая сила — внутри тебя! 🔥 Ты справишься! 💜",260,497,28,0.056338028169014086
1467,2025-06-12 13:00:01+00:00,"С Днём России! 🇷🇺 Сегодня день, когда мы, граждане этой великой страны, испытываем особую гордость за нашу Родину, её историю, культуру и достижения. Мы вместе строим будущее России, вместе преодолеваем трудности и вместе радуемся успехам. Пусть в этот день мы почувствуем ещё большее единство и любовь к нашей стране! ✨ С праздником 💜",335,642,28,0.04361370716510903
1468,2025-06-18 16:43:44+00:00,"Вы любите собачек? Мы - да! Поэтому сегодня пройдем тест на то, какой бы вы были породой песеля 🐶 https://uquiz.com/y5E8kw Ждем результаты в комментариях!",154,504,22,0.04365079365079365
1469,2025-06-22 15:00:46+00:00,"Важные новости за 3 недели июня в одном месте — скорее смотри наш новый дайджест новостей! 💜 💜День защиты детей 💜День России 💜День рождения ректора ГУАП - Антохиной Юлии Анатольевны 💜Собрание актива в антикафе 💜Фотосессия актива 💜Тесты на темы ""Какая ты планета?"" и ""Какая ты собака?"" 💜Легенды рекомендуют с Тёмой Ледовских и Елизаветой Олейниковой ﻿ Подписывайся и следи за новостями! ❤️‍🔥",390,473,18,0.03805496828752643
1470,2025-06-24 11:15:48+00:00,"Сессия почти позади 🚀 Подумай: еще недавно экзамены казались горой, а теперь ты уже на вершине. Осталось только аккуратно спуститься – и можно праздновать. Ты проделал огромную работу, не бросай все сейчас! 💜 Верь в себя! ✨",223,466,32,0.06866952789699571
1471,2025-07-01 14:50:18+00:00,"Сессия позади и каникулы официально открыты! ☀️ А на календаре уже июль. Второй месяц лета врывается в нашу жизнь, полный возможностей для отдыха, приключений и новых впечатлений. Наполните его яркими моментами и незабываемыми эмоциями! 💜 Делитесь в комментариях, какие планы на этот месяц? 👇",292,395,40,0.10126582278481013
1474,2025-07-02 10:20:16+00:00,"Сегодня особенный день 🎓 Институт информационных технологий и программирования выпускает своих талантливых выпускников. Мы поздравляем всех, кто сегодня получает свой долгожданный диплом. Позади годы упорной учебы, бессонных ночей, экзаменов и курсовых, а впереди – новые горизонты и невероятные возможности! 🚀 С праздником, выпускники! 🔥",338,481,45,0.09355509355509356
1476,2025-07-02 14:14:49+00:00,Наша активистка Диана Плыгун получила свой диплом💜 Она поделилась впечатлениями с нами. Поздравляем Диану с этим важным этапом в жизни! ✨ Ты молодец! 🥰,151,494,50,0.10121457489878542
1477,2025-07-03 14:30:01+00:00,"Мы не лошади, мы... члены профбюро! 🐬 И в этот раз у нас тест по известной кинокартине ""Игра в кальмара"" 🦑 https://uquiz.com/Al080A Быстрее проходите и скидывайте результаты в комментарии! И да, этот тест за второй сезон, можете не бояться спойлеров ✨",251,567,37,0.06525573192239859
1478,2025-07-05 10:47:45+00:00,"Привет, студент! 👋 На связи самое балдёжное профбюро 4 института, и мы знаем, как сделать твою студенческую жизнь максимально крутой и запоминающейся! 🐬 Мы занимаемся: 💜 Организацией крутых мероприятий такие, как Мансарда, Профарт, Академия Профорка 💜 Выездами в лес и коттеджи 💜 Решением твоих вопросов, помощь в учебе, защита прав, консультации по всем студенческим вопросам С нами ты можешь: 💜 Найти новых друзей и единомышленников 💜 Получить нереальные эмоции 💜 Стать частью дружной и активной команды 💜 Просто круто провести время Присоединяйся к нам и сделай свою студенческую жизнь незабываемой! 😉",604,557,48,0.08617594254937164
1488,2025-07-06 17:40:22+00:00,"💜Свежий дайджест новостей за прошедшие 2 недели уже здесь! 💜 💜 Балдёжный четвертый — это... 💜 Прошли выпускные в ГУАП 💜 Окончание сессии 💜 Инфографика об общежитиях 💜 Фотографии с мероприятия ""Мировое господство"" 💜 День рождения заместителя председателя ППОСА ГУАП Анны Востриковой 💜 Легенды рекомендуют: Илья Полозков, тест ""Кто ты из «‎Игры в кальмара»"", бинго ""Планы на лето"" Не пропусти самое интересное! 💜",410,563,22,0.03907637655417407
1490,2025-07-07 14:05:54+00:00,"Июль пахнет свободой, лесом и приключениями… ✨ Поймай момент, пока лето в самом разгаре! Пусть этот месяц запомнится не жарой, а эмоциями: первая ночь у костра, неожиданная поездка, новые знакомства и впечатления 💜 Пусть этот месяц станет началом чего-то прекрасного! 💫",269,499,32,0.06412825651302605
1491,2025-07-09 15:02:50+00:00,"Кто самый смекалистый? Время для тебя! 🧠 Решите ребус и быстрее присылайте ответ в комментариях, ведь кто быстрее напишет будет... умничкой! ✨",142,387,14,0.03617571059431524
1492,2025-07-11 15:57:44+00:00,"День шоколада 🍫 Сегодня в России отмечается самый вкусный праздник в году! Шоколад - это не просто сладость, это: 💜Источник эндорфинов: поднимает настроение и дарит ощущение счастья 💜Искусство в каждой плитке: от изысканных трюфелей до простых батончиков - шоколад вдохновляет кондитеров на настоящие шедевры 💜Бесконечное разнообразие: горький, молочный, белый, с орехами, фруктами, специями - каждый найдет свой любимый вкус Проходи опросы и напиши в комментариях сколько правильных ответов! 👇",494,368,25,0.06793478260869565
1497,2025-07-14 10:01:30+00:00,"Половина лета прошла! 🤯 Но не время унывать! Да, пол-лета пролетело, но это не повод грустить, а стимул действовать. Вспомни свои планы: отдых, хобби, встречи с близкими - ещё есть время для всего 🥰 Наполни дни радостью и впечатлениями 💜",237,411,26,0.06326034063260341
1499,2025-07-14 10:10:21+00:00,"Студенческий лидер СЗФО 🥇 Первичную профсоюзную организацию студентов и аспирантов ГУАП представляет Георгий Хателишвили, экс-председатель 8 института. Он уже прошёл этапы ""Автопортрет"", ""Тест"", ""Задача"", ""Проектирование"", ""Информационная работа"" и сейчас приступает к ""2 к 1"" 🤩 Давайте пожелаем ему удачи в комментариях! ✨",323,434,31,0.07142857142857142
1500,2025-07-16 14:20:50+00:00,"Куда же поступить?... 🤔 В четвертый институт! А чтобы ознакомиться с направлениями, мы предлагаем вам пройти развлекательный и вовсе не профориентационный тест ✨ https://uquiz.com/43vGJj Ждем твои результаты в комментариях 😉",224,406,19,0.046798029556650245
1501,2025-07-18 15:35:44+00:00,"Сегодня отмечаем день рождения Тетриса! 🎉 Эта простая, но гениальная игра покорила сердца миллионов и стала настоящим культурным феноменом. Даже спустя десятилетия она остается одной из самых узнаваемых и любимых видеоигр в мире. Тетрис объединяет людей разных возрастов и профессий, заставляя забыть обо всем на свете, пока фигурки послушно выстраиваются в линии ✨ Ответьте на пару вопросов и поделитесь в комментариях своими результатами! 💜",442,349,20,0.05730659025787966
1506,2025-07-20 07:07:18+00:00,"Всем привет! 👋 Меня зовут Кольцов Денис, я студент 3 курса направления «Прикладная информатика в информационной сфере» и председатель профбюро нашего института Сегодня вы проведёте день со мной, что ж, начинаем! 🚀",213,388,39,0.10051546391752578
1508,2025-07-20 09:24:53+00:00,"🌞 День в самом разгаре! Сегодня встретил двух наших будущих студентов — Соню и Ваню! 💫 Ребята с горящими глазами делились своими ожиданиями от студенческой жизни: новые знания, яркие знакомства, незабываемые моменты. 🎓✨ Так приятно видеть такой искренний интерес и энтузиазм! Добро пожаловать в нашу дружную семью! ❤️ Пишите в комментарии свои ожидания от студенчества, когда были абитуриентами👇🏼",396,454,30,0.06607929515418502
1510,2025-07-20 11:31:31+00:00,"2 июля мой родной город отмечал День рождения! 🎂 А ты знаешь, сколько лет исполнилось Владивостоку? Проверь свою эрудицию — участвуй в опросе!",142,384,24,0.0625
1512,2025-07-20 15:00:18+00:00,"Что ж, день заканчивается, поэтому пора поработать. Я уже почти доделал свое практическое задание - создание сайта для нашего проф бюро, а чем вы занимаетесь? Ставьте реакции ❤️ — Отдыхаю, заслуженно! 🔥 — Горю на дедлайнах! 🐬— Плыву по течению…",244,400,37,0.0925
1513,2025-07-20 17:20:35+00:00,"На этом на сегодня всё! Спасибо, что провели со мной день, спокойной ночи 💜 В канале объявляется перерыв на домашних животных, обязательно кидайте фотографии своих любимцев в комментарии 👇🏼",189,432,38,0.08796296296296297
1514,2025-07-21 12:20:36+00:00,"Ребята, это ваш шанс ✨ Поступление в университет — это не просто следующий шаг, это дверь в мир безграничных возможностей. Возможно, сейчас вам страшно, неуверенно, или вы сомневаетесь в своих силах. Главное — верить в себя и помнить, что каждый великий путь начинается с первого шага. Впереди вас ждут новые знания, интересные знакомства и, конечно же, активная студенческая жизнь 🤩 Верьте в себя, и у вас всё получится! 🚀",423,468,31,0.06623931623931624
1515,2025-07-21 18:20:45+00:00,"💜 Две недели пролетели незаметно, а значит, пора подводить итоги. Встречайте новый дайджест самых важных новостей! 🤩 💜 Институт №4 и его направления 💜 Инфографика про корпуса и отделы ГУАП 💜 Даты приема документов и онлайн-встречи со спутниками 💜 Студенческий лидер СЗФО 💜 Дни рождения директора 4-го института Татарниковой Татьяны Михайловны и активиста Сони Комоловой 💜 День с председателем профбюро — Денисом Кольцовым 💜 Легенды рекомендуют: Лена Беляева 💜 Викторины ко дню шоколада и ко дню рождения тетриса 💜 Ребус и тест ""Какое ты направление в институте № 4"" 💜 Бинго ""Как проходит твое лето"" и ""Какой ты абитуриент"" Надеемся, эта подборка помогла вам оставаться в курсе событий! ✨",687,539,28,0.05194805194805195
